{
  "contract": {
    "name": "hausman-hub-contour-apply-receipt",
    "version": 1
  },
  "operation_id": "0123456789abcdef0123456789abcdef",
  "request_id": "android-climate-0001",
  "contour_id": "climate",
  "status": "confirmed",
  "room_count": 1,
  "command_count": 3,
  "accepted_count": 3,
  "confirmed_room_count": 1,
  "changes": {
    "temperature": 1,
    "strategy": 1,
    "automatic_mode": 1
  },
  "reasons": [],
  "created_at": 1784280000000,
  "updated_at": 1784280001000
}
